web-scraper-order,web-scraper-start-url,rooms_area_price_raw,address_raw,price_raw,description_raw,text_raw
"1703955531-760","https://www.immoscout24.ch/de/wohnung/mieten/kanton-zuerich?pn=11","2 Zimmer, 43 m², CHF 1390.—","Grosswiesenstrasse 50, 8051 Zürich, ZH","CHF 1390.—","«Charmante Wohnung befristet bis 30.09.2024»","2 Zimmer, 43 m², CHF 1390.—Grosswiesenstrasse 50, 8051 Zürich, ZH«Charmante Wohnung befristet bis 30.09.2024»Die Wohnung mit 43 m² ist eine ideale und grosszügigie 2-Zimmer-Familienwohnung. Grüne Umgebung, öffentliche Verkehrsmittel, Einkaufsmöglichkeiten sind in wenigen Gehminuten zu erreichen. Diese hübsche Wohnung ist wie folgt ausgebaut:Abgeschlossene KücheHelles Wohnzimmer mit LaminatbodenbelagSchlafzimmer mit LaminatbodenbelagBadezimmerKeller- und EstrichabteilHeller Balkon mit Sicht ins GrüneBesichtigungstermine: 20.12.2023 um 15:00-16:00 Uhr22.12.2023 um 15:00-16:00 UhrBitte klingeln Sie bei Mujaj. Öffentlicher Verkehr sowie EinkaufsmöglichkeiAnbieter kontaktierenKontaktieren"
"1703955531-761","https://www.immoscout24.ch/de/wohnung/mieten/kanton-zuerich?pn=11","2,5 Zimmer, 63 m², CHF 1937.—","Luegislandstrasse 88, 8051 Zürich, ZH","CHF 1937.—","«Ihre neue Wohlfühloase»","2,5 Zimmer, 63 m², CHF 1937.—Luegislandstrasse 88, 8051 Zürich, ZH«Ihre neue Wohlfühloase»Per 01.03.2024 vermieten wir diese 2.5-Attikawohnung an zentraler Lage.Die Wohnung bietet Ihnen folgende Annehmlichkeiten:- Wohn- und Schlafzimmer sowie Nasszelle mit Parkettboden- Küche mit pflegeleichtem, dunklem Plattenboden- Grosszügige und helle Zimmer- Küche mit Glaskeramikherd, Geschirrspüler, Backofen auf Sichthöhe und viel Stauraum für Ihre Küchenutensilien- Badezimmer mit WC, Lavabo, Spiegelschrank und Badewanne- Balkon für gemütliche Sonnenstunden- Eigenes Kellerabteil- Waschküche und Trockenraum zur Mitbenutzung- Lift vorhandenHaustAnbieter kontaktierenKontaktieren"
"1703955531-762","https://www.immoscout24.ch/de/wohnung/mieten/kanton-zuerich?pn=11","3,5 Zimmer, 100 m², CHF 4350.—","Färberstrasse 28, 8008 Zürich, ZH","CHF 4350.—","«Exklusive Stadtwohnung im Zürcher Seefeld»","3,5 Zimmer, 100 m², CHF 4350.—Färberstrasse 28, 8008 Zürich, ZH«Exklusive Stadtwohnung im Zürcher Seefeld»Wir vermieten diese moderne und charmante Wohnung im trendigen Seefeldquartier. Die Wohnung besticht durch folgende Punkte:Minergie-Standardneuster Ausbaustandard Komfortlüftunglichtdurchflutete Räumeeleganter AusbauEichenparkett in allen Zimmernoffene, hochwertige Küche mit Glaskeramik, Geschirrspüler und Steamergrosszügiges Wohn- und Esszimmermodernes Badezimmer / WC mit PlattenbodenEigener Waschturm vorhandenBalkongrosszügiges KellerabteilBei Bedarf kann zusätzlich ein Einstellplatz à CHF 350.00/Monat dazu gemietet werden. Haben wir Ihr InteAnbieter kontaktierenKontaktieren"
"1703955531-763","https://www.immoscout24.ch/de/wohnung/mieten/kanton-zuerich?pn=11","3,5 Zimmer, 81 m², CHF 1955.—","Zelglistrasse 78, 8122 Binz, ZH","CHF 1955.—","«Helle Wohnung in grüner und ruhiger Umgebung»","3,5 Zimmer, 81 m², CHF 1955.—Zelglistrasse 78, 8122 Binz, ZH«Helle Wohnung in grüner und ruhiger Umgebung»An sonniger Wohnlage vermieten wir diese gemütliche 3.5-Zimmerwohnung im Dachgeschoss, welche Ihnen den folgenden Ausbaustandard zu bieten hat:- Entrée mit Einbauschränken- alle Wohnräume mit Parkettboden- abgeschlossene Küche mit Plattenboden- mit Glaskeramikherd- und Geschirrspüler - Badezimmer/WC - separate Dusche/WC- Abstellraum- Balkon- KellerabteilDie Musterfotos zeigen lediglich den Ausbaustandard der Wohnung. Die genaue Raumaufteilung entnehmen Sie bitte dem Grundrissplan. Bei Bedarf kann ein Einstellplatz in der Tiefgarage für CHF 120.Anbieter kontaktierenKontaktieren"
"1703955531-764","https://www.immoscout24.ch/de/wohnung/mieten/kanton-zuerich?pn=11","3,5 Zimmer, 72 m², CHF 1465.—","Eilweg 20, 8634 Hombrechtikon, ZH","CHF 1465.—","«Helle und grosszügige Wohnung fürs kleine Budget!»","3,5 Zimmer, 72 m², CHF 1465.—Eilweg 20, 8634 Hombrechtikon, ZH«Helle und grosszügige Wohnung fürs kleine Budget!»Wir vermieten per 01. Februar 2024 diese gemütliche und helle Wohnung an ruhiger Wohnlage im wunderschönen Hombrechtikon.Die Wohnung bietet Ihnen folgende Vorzüge: - Wohnräume sind mit schönen Laminat ausgestattet - grosse Wohnräume - praktische Einbauschränke im Korridor - Badezimmer mit Badewanne - sämtliche Räume lichtdurchflutet - gemütlicher Balkon - separates KellerabteilDie Bushaltestelle, mehrere Einkaufsmöglichkeiten sowie Naherholungsgebiete im Grünen sind in wenigen Gehminuten erreichbar.Ein Einstellplatz in der Tiefgarage kann für CAnbieter kontaktierenKontaktieren"
"1703955531-765","https://www.immoscout24.ch/de/wohnung/mieten/kanton-zuerich?pn=11","2,5 Zimmer, 89 m², CHF 4265.—","Klausstrasse 23, 8008 Zürich, ZH","CHF 4265.—","«Repräsentative Wohnung an zentraler Lage»","2,5 Zimmer, 89 m², CHF 4265.—Klausstrasse 23, 8008 Zürich, ZH«Repräsentative Wohnung an zentraler Lage»Die repräsentative Wohnung im beliebtem Seefeld besticht durch die moderne Architektur und hohem Ausbaustandard:- Miele Küchengeräte (Induktionskochfeld, Backofen, Steamer und üblichem Komfort)- Edler, geölter Parkettboden in allen Wohn- und Schlafräumen- Wände und Decken Weissputz- Elektrische Beschattung / Verdunklung sowie Dimmer Lichtschalter- Bad mit WC, Dusche und Lavabo- Sep. WC mit Lavabo- Miele Kombigerät WM/Tumbler- Bodenheizung in allen Räumen- Sep. Garderobe mit Einbauschränken- Genügend Multimediaanschlüsse- Überdachte Loggia mit S"
"1703955531-766","https://www.immoscout24.ch/de/wohnung/mieten/kanton-zuerich?pn=11","CHF 1500.—","Flurstrasse 12/14, 8302 Kloten, ZH","CHF 1500.—","«Ihr Business Apartment möbliert und per sofort einzugsbereit»","CHF 1500.—Flurstrasse 12/14, 8302 Kloten, ZH«Ihr Business Apartment möbliert und per sofort einzugsbereit»Einziehen und wohlfühlen ist hier die Devise.Profitieren Sie an diesem Standort von einer zentralen Wohnlage und geniessen Sie die Nähe zum weltbekannten Flughafen Zürich.Ihre neue Wohnoase überrascht Sie mit folgenden Highlights, welche im Mietpreis inklusive sind:-Sämtliche Nebenkosten wie Strom, Wasser und Heizung -Hochwertige und komplette Einrichtung-WLAN, TV, Radio-Badezimmer mit Dusche und WC-Voll ausgestattete Kochnische-Kaffeemaschine, Teekocher-Zusätzliche ausgestattete Küche auf jedem StockwerkFür Ihre Fahrzeuge können Sie TiefgarageAnbieter kontaktierenKontaktieren"
"1703955531-767","https://www.immoscout24.ch/de/wohnung/mieten/kanton-zuerich?pn=11","1,5 Zimmer, 22 m², CHF 2150.—","Am Wasser 161, 8049 Zürich, ZH","CHF 2150.—","«WOW AN DER LIMMAT»","1,5 Zimmer, 22 m², CHF 2150.—Am Wasser 161, 8049 Zürich, ZH«WOW AN DER LIMMAT»An zentraler Lage vermieten wir diese möblierten Apartments der besonderen Art - komfortabel und sofort bezugsbereit. Erleben Sie gemütliches Wohnen direkt an der Limmat!Ihre neuen vier Wände überraschen Sie mit folgenden Highlights, welche im MIETPREIS INKLUSIVE sind:+ Sämtliche Nebenkosten wie Strom, Wasser, Heizung + WLAN+ Komplett ausgestattete Küche mit Kühlschrank und 2-Zonen Kochfeld+ Wasserkocher, Pfannen, Geschirr+ Flachbildschirm Fernseher + Kabelfernsehen + Badezimmer mit Dusche+ Gegensprechanlage+ Moderne Sicherheitsschliessanlage mAnbieter kontaktierenKontaktieren"
"1703955531-768","https://www.immoscout24.ch/de/wohnung/mieten/kanton-zuerich?pn=11","1,5 Zimmer, 25 m², CHF 2250.—","Badenerstrasse 250, 8004 Zürich, ZH","CHF 2250.—","«Attraktiv, möbliert direkt beim Lochergut»","1,5 Zimmer, 25 m², CHF 2250.—Badenerstrasse 250, 8004 Zürich, ZH«Attraktiv, möbliert direkt beim Lochergut»In der begehrten Wohnsiedlung Zürich-Lochergut an der Badenerstrasse 250 entsteht ein neues, topmodernes Mehrfamilienhaus. An bester Wohnlage vermieten wir per sofort oder nach Vereinbarung, 30 möblierte 1.5 - 3.5 Zimmer-Luxus-Mietwohnungen mit hochwertigem Innenausbau. Lassen Sie sich von den neu erstellten Mietobjekten inspirieren.Dieses Angebot bietet folgende *Mehr-Leistung*:+ Sämtliche Nebenkosten wie Strom, Wasser und Heizung sind im Mietpreis inbegriffen !+ Möblierte 1.5 -Zimmer-Wohnungen + Ausbaustandard auf höchstem Niveau+ Sehr hochweAnbieter kontaktierenKontaktieren"
"1703955534-769","https://www.immoscout24.ch/de/wohnung/mieten/kanton-zuerich?pn=10","3,5 Zimmer, 96 m², CHF 2710.—","Tösstalstr. 116, 8623 Wetzikon ZH, ZH","CHF 2710.—","«Attikawohnung mit grosser Terrasse»","3,5 Zimmer, 96 m², CHF 2710.—Tösstalstr. 116, 8623 Wetzikon ZH, ZH«Attikawohnung mit grosser Terrasse»Im Areal Vogelsang bietet Ihnen die grosszügige Attikawohnung folgende Vorzüge:- Parkett in allen Zimmern, Nasszelle mit Plattenboden- Bad/WC mit Waschturm- Küche mit Induktionsherd, Backofen und Geschirrspüler- Einbauschränke im Korridor- Reduit- Ganze Wohnung mit Bodenheizung- Ungedeckter Balkon (ca. 14m2)- Grosse Terrasse (ca. 78m2) mit Pergola- Lift vorhanden- Eigenes Kellerabteil- Einstellplatz (CHF 130.00/Monat) und Bastelräume dazumietbarEine Liegenschaft mit LIVING SERVICES | www.livingservices.ch- MultimediasteckdoseAnbieter kontaktierenKontaktieren"
"1703955534-770","https://www.immoscout24.ch/de/wohnung/mieten/kanton-zuerich?pn=10","3,5 Zimmer, 110 m², CHF 4155.—","Letzigraben 114, 8047 Zürich, ZH","CHF 4155.—","««LETZ9». Let'z live a good life.»","3,5 Zimmer, 110 m², CHF 4155.—Letzigraben 114, 8047 Zürich, ZH««LETZ9». Let'z live a good life.»www.letz9-zh.chSie sind auf der Suche nach dem Besonderen? Im Letz9 werden Sie fündig! Lassen Sie sich begeistern, wohnen Sie auf zwei Stockwerken mit zwei Bädern, zwei Schlafzimmern und zwei Aussenflächen in den wunderschönen 3½-Zimmer-Maisonettewohnungen im «LETZ9».Sichern Sie sich jetzt eine der letzten 3½-Zimmer-Maisonettewohnungen im «LETZ9», im beliebten Zürcher Quartier Albisrieden (Kreis 9) und lassen Sie Ihren Wohntraum wahr werden.Was Ihnen die 3½-Zimmer-Maisonettewohnung im «LETZ9» alles bietet:Grosszügige und gut möblierbare Grundri"
"1703955534-771","https://www.immoscout24.ch/de/wohnung/mieten/kanton-zuerich?pn=10","4,5 Zimmer, 98 m², CHF 2050.—","Am Leebach 10, 8498 Gibswil, ZH","CHF 2050.—","«Naturnah und modern»","4,5 Zimmer, 98 m², CHF 2050.—Am Leebach 10, 8498 Gibswil, ZH«Naturnah und modern»Per 01. Februar 2024 oder nach Vereinbarungvermieten wir eine 4.5-Zimmerwohnung im ErdgeschossModern und im Einklang mit der NaturDie wunderschöne Wohnung überzeugt durch Ihren hohen Ausbaustandard:Offene Küchen mit hochwertigen V-Zug ApparatenZwei Nasszellen mit bodenebener Dusch und BadewanneWaschturm im BadHochwertiger Eichen ParkettFussbodenheizungGrosszügige TerrasseParkplätze innen / Aussenparkplätze können dazugemietet werden.Optimal versorgt und vernetztDie Überbauung liegt nahe des Dorfkerns, der nebst einer Einkaufsmöglichkeit auch eiAnbieter kontaktierenKontaktieren"
"1703955534-772","https://www.immoscout24.ch/de/wohnung/mieten/kanton-zuerich?pn=10","4,5 Zimmer, 104 m², CHF 2695.—","Wegacher 4, 8311 Brütten, ZH","CHF 2695.—","«Moderne Wohnung mit eigenem Waschturm»","4,5 Zimmer, 104 m², CHF 2695.—Wegacher 4, 8311 Brütten, ZH«Moderne Wohnung mit eigenem Waschturm»Die Liegenschaft am Wegacher 4/6 in Brütten wurde 2019 erbaut und umfasst zwei Mehrfamilienhäuser mit insgesamt 12 Wohnungen.Das Mehrfamilienhaus liegt an erhöhter Lage in Brütten, wodurch Sie einen weiten Ausblick über die umliegenden Dächer und Grünflächen geniessen.Ausstattung:Geschliffener Anhydritboden in sämtlichen Wohn- und SchlafzimmernOffene Küche mit hochwertigen GerätenBadezimmer mit Badewanne, Dusche und DoppellavaboSeparates Gäste WCEingangsbereich mit GarderobeWaschmaschine und Trockner im BadezimmerBalkon Richtung SüdenKellerabte"
"1703955534-773","https://www.immoscout24.ch/de/wohnung/mieten/kanton-zuerich?pn=10","2 Zimmer, CHF 1960.—","Griesernweg 21, 8037 Zürich, ZH","CHF 1960.—","«Wohnung an bevorzugter Lage in ZH Wipkingen»","2 Zimmer, CHF 1960.—Griesernweg 21, 8037 Zürich, ZH«Wohnung an bevorzugter Lage in ZH Wipkingen»Im gepflegten Mehrfamilienhaus Griesernweg 21 in 8037 Zürich, vermieten wir per 1. April 2024 diese helle 2-Zimmer-Wohnung im 2. Obergeschoss.Die Liegenschaft befindet sich an ruhiger und sonniger Hanglage, unterhalb des Waidspitals.Das Naherholungsgebiet entlang der Limmat ist 650 Meter entfernt. Die Bushaltestelle Zürich Lehenstrasse, ist 270 Meter von der Liegenschaft entfernt. Das Central sowie den Bahnhofquai/Hauptbahnhof erreicht man in 12 Fahrminuten mit dem öffentlichen Verkehr.Die Wohnung bietet den folgenden Ausbaustandard: Separate KNeu"
"1703955534-774","https://www.immoscout24.ch/de/wohnung/mieten/kanton-zuerich?pn=10","2,5 Zimmer, 60 m², CHF 1960.—","Seebnerstrasse 1, 8185 Winkel, ZH","CHF 1960.—","«Traumhaft besonnte Attikawohnung im Grünen»","2,5 Zimmer, 60 m², CHF 1960.—Seebnerstrasse 1, 8185 Winkel, ZH«Traumhaft besonnte Attikawohnung im Grünen»Wir vermieten eine moderne 2.5-Zimmer-Attikawohnung in einer sehr gepflegten, modernen sowie begrünten Überbauung in Winkel. Die optimale Lage sowie die Nähe zum Naherholungsgebiet bieten den Mietern eine einmalige Wohlfühloase!Folgende Highlights zeichnen die Attikawohnung aus:hochwertiger, dunkler Landhausdielen-Vinylboden in ganzer WohnungViele Fenster bringen ausreichend Licht in die Wohnung und gestalten diese durchgehend hell und freundlichFarblich alles abgestimmt und optimales Lichtkonzeptoffener, heller Wohn-/Essbereich mit stilvoller,Neu"
"1703955534-775","https://www.immoscout24.ch/de/wohnung/mieten/kanton-zuerich?pn=10","1,5 Zimmer, 26 m², CHF 1800.—","8152 Glattbrugg, ZH","CHF 1800.—","«Neubau - Wohlfühlfeeling garantiert»","1,5 Zimmer, 26 m², CHF 1800.—8152 Glattbrugg, ZH«Neubau - Wohlfühlfeeling garantiert»Sind Sie auf der Suche nach einer geeigneten Wohnlage und möchten nicht auf einen modernen Ausbau verzichten? Dann dürfen Sie sich diese Neubau-Wohnperle nicht entgehen lassen. Der ideale Wohnort für Pendler und Wochenaufenthalter, die die Nähe zum Bahnhof schätzen.Ein einmaliges Raumerlebnis bietet Ihnen der geräumige Wohn-, Schlaf- und Essbereich, wobei die grosse Fensterfront sowie der edle Parkettboden ein besonders gemütliches Wohlgefühl ausstrahlen. Das exklusive Tageslicht-Badezimmer ist mit einer grossen Dusche, Lavabo und WC ausgestattNeu"
"1703955534-776","https://www.immoscout24.ch/de/wohnung/mieten/kanton-zuerich?pn=10","3,5 Zimmer, 81 m², CHF 2285.—","Seebnerstrasse 3, 8185 Winkel, ZH","CHF 2285.—","«Traumhaft besonnte Attikawohnung im Grünen!»","3,5 Zimmer, 81 m², CHF 2285.—Seebnerstrasse 3, 8185 Winkel, ZH«Traumhaft besonnte Attikawohnung im Grünen!»Wir vermieten eine moderne 3.5-Zimmer-Attikawohnung in einer sehr gepflegten, modernen sowie begrünten Überbauung in Winkel. Die optimale Lage sowie die Nähe zum Naherholungsgebiet bieten den Mietern eine einmalige Wohlfühloase!Folgende Highlights zeichnen die Attikawohnung aus:hochwertiger, dunkler Landhausdielen-Laminatboden in ganzer WohnungViele Fenster bringen ausreichend Licht in die Wohnung und gestalten diese durchgehend hell und freundlichFarblich alles abgestimmt und optimales Lichtkonzeptzwei grosszügige SchlafzimmerMasterbadezimmer:Neu"
"1703955534-777","https://www.immoscout24.ch/de/wohnung/mieten/kanton-zuerich?pn=10","4,5 Zimmer, 105 m², CHF 2007.—","Unterdorfstrasse 50, 8494 Bauma, ZH","CHF 2007.—","«Schöne Gartenwohnung zu vermieten»","4,5 Zimmer, 105 m², CHF 2007.—Unterdorfstrasse 50, 8494 Bauma, ZH«Schöne Gartenwohnung zu vermieten»Schöne GartenwohnungPer 1. April 2024 vermieten wir diese tolle Wohnung in Bauma.Alle Schlafzimmer sowie das Wohn- und Esszimmer sind mit hellem Vinylboden ausgelegt.Die offene Küche mit Granitabdeckung ist mit einem Glaskeramikherd, Backofen und Geschirrspüler ausgestattet.Neben dem Tageslicht-Badezimmer mit Doppellavabo, Badewanne sowie Waschmaschine und Tumbler verfügt die Wohnung über eine weitere Nasszelle mit Dusche und WC. Zusätzlichen Komfort bieten die elektrischen Storen in allen Räumen.Der grosszügige Sitzplatz lädt an Sommertagen zuNeu"
"1703955534-778","https://www.immoscout24.ch/de/wohnung/mieten/kanton-zuerich?pn=10","2,5 Zimmer, 85 m², CHF 3040.—","Im Baumgarten 6, 8802 Kilchberg ZH, ZH","CHF 3040.—","«Gepflegte 2.5-Zimmer-Wohnung mit 85 m2 Wohnfläche und Balkon von 14 m2, Toplage Kilchberg»","2,5 Zimmer, 85 m², CHF 3040.—Im Baumgarten 6, 8802 Kilchberg ZH, ZH«Gepflegte 2.5-Zimmer-Wohnung mit 85 m2 Wohnfläche und Balkon von 14 m2, Toplage Kilchberg»BESICHTIGUNG OHNE VORANMELDUNG:MITTWOCH, DEN 10. JANUAR 2024, UM 18.00 UHRZu vermieten per 1. Februar 2024, eine gepflegte 2.5-Zimmer-Wohnung an bester Lage in Kilchberg. Die Wohnung befindet sich im 2. OG, mit Weitsicht vom Balkon ins Grüne und auf die Berge. Die Lage ist absolut ruhig. Die Das Mietobjekt verfügt über folgendes Raumprogramm:Wohn / Esszimmer 38 m2, mit Parkettboden und CheminéeBalkon mit 14 m2, vom Wohnzimmer erschlossenKüche mit 8 m2, weissen Fronten und jeglichem Komfort Entrée von 10 m2 mit Wandschränken und ParkettbodenSchlNeu"
"1703955534-779","https://www.immoscout24.ch/de/wohnung/mieten/kanton-zuerich?pn=10","3,5 Zimmer, 96 m², CHF 2250.—","Chämletenweg 18, 8153 Rümlang, ZH","CHF 2250.—","«Zuhause fühlen»","3,5 Zimmer, 96 m², CHF 2250.—Chämletenweg 18, 8153 Rümlang, ZH«Zuhause fühlen»Die charmante Wohnsiedlung Farfalla liegt im Herzen von Rümlang. Einkaufsmöglichkeiten, Kindergärten, Schulen und der Bahnhof sind in wenigen Minuten zu Fuss erreichbar. Die ideale Lage zwischen Stadt und Flughafen in Kombination mit der Idylle im Grünen und dem charmanten, ländlichen Dorfkern machen Rümlang zu einer äusserst attraktiven und beliebten Wohngemeinde. Die Wohnung bietet Ihnen folgenden Komfort:Kompletter Wohnbereiche mit PlattenbodenAlle Zimmer mit ParkettbodenModerne Küche mit Geschirrspüler und GlaskeramikkochfeldBad/WCDusche/WC"
"1703955534-780","https://www.immoscout24.ch/de/wohnung/mieten/kanton-zuerich?pn=10","4,5 Zimmer, 99 m², CHF 2176.—","Bächelacherstrasse 5, 8132 Hinteregg, ZH","CHF 2176.—","«Wohnen mit Lebensqualität»","4,5 Zimmer, 99 m², CHF 2176.—Bächelacherstrasse 5, 8132 Hinteregg, ZH«Wohnen mit Lebensqualität»Per 16.01.2024 vermieten wir diese schöne und moderne 4.5-Zimmerwohnung. Die Wohnung bietet Ihnen folgende Annehmlichkeiten: - Wohn- und Schlafzimmer mit Parkettboden- Küche, Nasszellen sowie Korridor mit Plattenboden- Grosszügiger Wohn- und Essbereich- Helle Küche mit Glaskeramikherd, Geschirrspüler, Backofen und genügend Stauraum für Ihre Küchenutensilien - Badezimmer mit Doppellavabo, Spiegelschrank, Badewanne und Tageslicht - Separates WC mit Lavabo und Spiegelschrank- Korridor mit praktischen Einbauschränken, welche für zusätzlichen StauraAnbieter kontaktierenKontaktieren"
"1703955534-781","https://www.immoscout24.ch/de/wohnung/mieten/kanton-zuerich?pn=10","3 Zimmer, 79 m², CHF 2986.—","8050 Zürich, ZH","CHF 2986.—","«New 3 room apartment in Oerlikon»","3 Zimmer, 79 m², CHF 2986.—8050 Zürich, ZH«New 3 room apartment in Oerlikon»(English below) Wir suchen per 1. März 2024 neue Mieter für unsere moderne 79 m2 Wohnung in Oerlikon! Das Gebäude ist ein Neubau und wurde im Sommer 2022 erstmals bezogen. Die Wohnung hat 2 Schlafzimmer, 1 Badezimmer und eine offene Küche im grossen Wohnzimmer. Die Wohnung befindet sich im Erdgeschoss und verfügt außerdem über eine kleine Terrasse, die zu einem gemeinsamen Gartenbereich führt. Die Wohnung hat eine Bodenheizung Im Untergeschoss gibt es 2 Waschmaschinen und einen Wäschetrockner, die über eine Buchungs-App genutzt werden können. DAnbieter kontaktierenKontaktieren"
"1703955534-782","https://www.immoscout24.ch/de/wohnung/mieten/kanton-zuerich?pn=10","2 Zimmer, 56 m², CHF 2610.—","Scheuchzerstrasse 66, 8006 Zürich, ZH","CHF 2610.—","«VIVA - Stilvolles Leben. Urbane Stille.»","2 Zimmer, 56 m², CHF 2610.—Scheuchzerstrasse 66, 8006 Zürich, ZH«VIVA - Stilvolles Leben. Urbane Stille.»Die frisch sanierte Wohnüberbauung VIVA an der Scheuchzerstrasse 64/66 in 8006 Zürich fügt sich harmonisch in das charmante und vielfältige Stadtquartier «Oberstrass» ein. Der Kreis 6 gehört mitunter zu den schönsten Stadtteilen Zürichs und zeichnet sich durch seine historische Architektur, die zahlreichen Optionen zur Freizeitgestaltung, die Nähe zur Natur, die Quartiertraditionen und die ruhige Wohnatmosphäre aus.Im Inserat handelt es sich um die letzte freie Wohnung. Es ist eine 1.5- Zimmerwohnung / Studio im Erdgeschoss mit rund 56m2 Fläche"
"1703955534-783","https://www.immoscout24.ch/de/wohnung/mieten/kanton-zuerich?pn=10","2,5 Zimmer, 42 m², CHF 3150.—","Am Wasser, 8049 Zürich, ZH","CHF 3150.—","«Traumhafte Wohnoase direkt an der Limmat»","2,5 Zimmer, 42 m², CHF 3150.—Am Wasser, 8049 Zürich, ZH«Traumhafte Wohnoase direkt an der Limmat»An zentraler Lage vermieten wir diese möblierten Apartments der besonderen Art - komfortabel und sofort bezugsbereit. Erleben Sie gemütliches Wohnen direkt an der Limmat!Die helle Wohnung brilliert mit einem grosszügigen Wohnzimmer mit offener Küche und einladendem Essbereich. Im gemütlichen Schlafzimmer befindet sich ein integrierter Kleiderschrank. Die wunderschöne Terrasse mit einmaligem Ausblick über die Limmat erreichen Sie über das Wohn- sowie Schlafzimmer. Zusätzlich überraschen sie ihre neuen vier Wände mit folgenden Highlights, welche Anbieter kontaktierenKontaktieren"
"1703955534-784","https://www.immoscout24.ch/de/wohnung/mieten/kanton-zuerich?pn=10","1 Zimmer, 24 m², CHF 1800.—","Glatttalstrasse 175, 8153 Rümlang, ZH","CHF 1800.—","«Business Apartments in Flughafennähe»","1 Zimmer, 24 m², CHF 1800.—Glatttalstrasse 175, 8153 Rümlang, ZH«Business Apartments in Flughafennähe»An exklusiver Lage entsteht ein neues Mehrfamilienhaus mit 44 Wohnungen, Tankstelle und Gewerbefläche.Per 01.07.2023 vermieten wir diese möblierten Apartments der besonderen Art - komfortabel und sofort bezugsbereit. Erleben Sie gemütliches Wohnen im Herzen von Rümlang.Ihre neuen vier Wände überraschen Sie mit folgenden Highlights, welche im Mietpreis inklusive sind:+ Sämtliche Nebenkosten wie Strom, Wasser, Heizung + Internet via WLAN+ Komplett ausgestattete Küche mit Kühlschrank und Induktionsherd+ Wasserkocher, Pfannen, Geschirr+ FlachbildscAnbieter kontaktierenKontaktieren"
"1703955534-785","https://www.immoscout24.ch/de/wohnung/mieten/kanton-zuerich?pn=10","4,5 Zimmer, 145 m², CHF 2018.—","Esslingerstrasse 4, 8618 Oetwil am See, ZH","CHF 2018.—","«Charmantes 4.5-Zimmer Flarz-Mittelhaus»","4,5 Zimmer, 145 m², CHF 2018.—Esslingerstrasse 4, 8618 Oetwil am See, ZH«Charmantes 4.5-Zimmer Flarz-Mittelhaus»Charmantes 4.5-Zimmer Flarz-MittelhausPer 1. März 2024 oder nach Vereinbarung vermieten wir ein gemütliches 4.5-Zimmer Flarz-Mittelhaus mit 145 m2 Fläche auf 3 Etagen. Es handelt sich um eine Liegenschaft aus dem 17. Jahrhundert. Im Jahr 2003 wurde der Hausteil ausgehöhlt und komplett saniert.Der charmante Flarz-Hausteil verfügt über folgende Annehmlichkeiten: Erdgeschoss:- Eigener Eingangsbereich- Grosse, moderne Küche- Grosses Wohnzimmer- Einbauschrank neben Treppe1. Obergeschoss- Zwei Schlafzimmer- Waschmaschine/Tumbler- Modernes Bad mit Bad"
"1703955534-786","https://www.immoscout24.ch/de/wohnung/mieten/kanton-zuerich?pn=10","3,5 Zimmer, 85 m², CHF 2750.—","Im oberen Boden 8, 8708 Männedorf, ZH","CHF 2750.—","«3.5 Zimmerwohnung in Männedorf ( Eigentumsstandard )»","3,5 Zimmer, 85 m², CHF 2750.—Im oberen Boden 8, 8708 Männedorf, ZH«3.5 Zimmerwohnung in Männedorf ( Eigentumsstandard )»Wir vermieten per 01.02.2024 diese schöne 3.5 Zimmerwohnung in Männedorf.Die Wohnungen ist für Familien, Paare und Singles konzipiert worden.Komfort, moderne Grundrisse sowie ein gehobener Ausbaustandard warten auf Sie.Die Wohnung bietet Ihnen die folgende Ausstattungen:Parkett in den WohnräumenWände in den Wohn- und Schlafräumen sind mit Weissputz gestrichenDecken Weissputz gestrichen oder Holz lasiert in der AttikaGarderobenschränke aus Holz mit weisser KunstharzoberflächeModerne offene Küchen mit Glaskeramikherd, Backofen, Geschirrspüler, KüAnbieter kontaktierenKontaktieren"
"1703955534-787","https://www.immoscout24.ch/de/wohnung/mieten/kanton-zuerich?pn=10","3 Zimmer, 77 m², CHF 2128.—","Langackerstrasse 10, 8330 Pfäffikon ZH, ZH","CHF 2128.—","«MODERNE 3-ZIMMER-GARTENWOHNUNG MIT MINERGIE-STANDART»","3 Zimmer, 77 m², CHF 2128.—Langackerstrasse 10, 8330 Pfäffikon ZH, ZH«MODERNE 3-ZIMMER-GARTENWOHNUNG MIT MINERGIE-STANDART»Wir vermieten per 01.02.2024 eine helle, moderne und ruhige 3-Zimmerwohnung im EG.Die Wohnung verfügt über:Parkettboden in allen Zimmernoffene Küche mit Granitabdeckung, grossem Kühlschrank, Glaskeramik, uvm.Bad/ WC mit eigenem Waschturmseparates WCEinbauschränke im Korridor23 m2 grosser Gartensitzplatzgrosses Kellerabteil mit SteckdoseDer Pfäffikonsee ist in 10 Minuten Fussweg zu erreichen.Haben wir Ihr Interesse geweckt? Die Wohnungsbesichtigung findet wie folgt statt:Mittwoch, 03. Januar 2024 zwischen 16.00 -18.00 Uhr.Bitte bei Lippert klingAnbieter kontaktierenKontaktieren"
