web-scraper-order,web-scraper-start-url,rooms_area_price_raw,address_raw,price_raw,description_raw,text_raw
"1703955467-274","https://www.immoscout24.ch/de/wohnung/mieten/kanton-zuerich?pn=31","5,5 Zimmer, 182 m², CHF 7500.—","Höhestrasse 40, 8702 Zollikon, ZH","CHF 7500.—","«Ihr neues Zuhause mit Seesicht»","5,5 Zimmer, 182 m², CHF 7500.—Höhestrasse 40, 8702 Zollikon, ZH«Ihr neues Zuhause mit Seesicht»Nach Vereinbarung vermieten wir diese moderne und ideal gelegene 5.5 Zimmer-Wohnung in Zollikon. Die charmante Wohnung bietet nebst der tollen Seesicht folgende Annehmlichkeiten: - moderne offene Küche- Parkettboden in Wohn- und Schlafzimmer- Cheminee im Wohnzimmer - Korridor mit Natursteinbelag und Garderobe- 3 Nasszellen mit Badewanne und Dusche, davon 2 Master-Bathroom- Balkon mit Seesicht Die Liegenschaft ist hervorragend gelegen, so dass Sie zu jeder Tageszeit von guter Besonnung profitieren. Wer hier wohnt, geniesst Ruhe, sowie eine wunde"
"1703955467-275","https://www.immoscout24.ch/de/wohnung/mieten/kanton-zuerich?pn=31","3,5 Zimmer, 65 m², CHF 3650.—","Sonnentalstrasse 17, 8600 Dübendorf, ZH","CHF 3650.—","«Über den Dächern - Neubau Three Point - Erstvermietung»","3,5 Zimmer, 65 m², CHF 3650.—Sonnentalstrasse 17, 8600 Dübendorf, ZH«Über den Dächern - Neubau Three Point - Erstvermietung»Über den Dächern - Neubauwohnung auf der 20. EtagePer Mitte März 2024 oder nach Vereinbarung vermieten wir in der neuen Überbauung ""Three Point"" an der Sonnentalstrasse 17 in Dübendorf-Stettbach eine 3.5-Zimmerwohnung mit folgender Ausstattung: offene Küche mit modernen Küchengeräten Badezimmer mit Duschehochwertiger Eichenparkett in der ganzen WohnungPlattenboden im BadezimmerWaschturm im KorridorBalkonLiftEin Einstellhallenplatz kann optional für CHF 200.00/Mt. dazu gemietet werden. Haben wir Ihr Interesse geweckt? Für weitere Auskünfte oder"
"1703955467-276","https://www.immoscout24.ch/de/wohnung/mieten/kanton-zuerich?pn=31","4,5 Zimmer, 156 m², CHF 5360.—","Rebwiesstr. 58, 8702 Zollikon, ZH","CHF 5360.—","«Befristet bis zum 31.03.2025 - Moderne Wohnung als Zwischennutzung»","4,5 Zimmer, 156 m², CHF 5360.—Rebwiesstr. 58, 8702 Zollikon, ZH«Befristet bis zum 31.03.2025 - Moderne Wohnung als Zwischennutzung»Sie sind sich Wohnen auf hohem Standard gewohnt? Dann haben wir genau das Richtige für Sie! Die moderne Liegenschaft verfügt über einen hochwertigen Ausbaustandard und besticht besonders durch folgende Merkmale:Parkettboden in ganzer WohnungModerne Küche mit Steamer (V-Zug Geräte)Bad/WC Dusche/WCEigener Waschturm (V-Zug Geräte) in der WohnungGrosser sonniger Balkon Öffentliche Verkehrsmittel (Forchbahn) in wenigen Gehminuten  erreichbarInternationale Schule in der Näheeigenes KellerabteilWährend der Mietdauer wird es v zu Bauarbeiten in der LieAnbieter kontaktierenKontaktieren"
"1703955467-277","https://www.immoscout24.ch/de/wohnung/mieten/kanton-zuerich?pn=31","2,5 Zimmer, Preis auf Anfrage","Restelbergstrasse 28, 8044 Zürich, ZH","Preis auf Anfrage","«Schöner Wohnen am Züriberg - Mietzinse siehe Beilage»","2,5 Zimmer, Preis auf AnfrageRestelbergstrasse 28, 8044 Zürich, ZH«Schöner Wohnen am Züriberg - Mietzinse siehe Beilage»Möchten Sie temporär oder auch etwas länger in einem von 14 traumhaft schönen Appartements wohnen, welche bis ins letzte Detail raffiniert und gepflegt ausgestattet und eingerichtet wurden. Dabei steht Ihnen eine ganze Auswahl von «Typen» zur Verfügung, welche bestimmt Ihren individuellen Geschmack treffen werden. Neben liebevoll gestalteten Unikaten kommen Sie in den Genuss der ruhigen und beschaulichen Lage am Züriberg. Eine perfekte OEV-Anbindung rundet dieses großartige Angebot ab.Gerne bedienen wir Sie vorab mit der umfassenden Vermietungs"
"1703955467-278","https://www.immoscout24.ch/de/wohnung/mieten/kanton-zuerich?pn=31","2,5 Zimmer, Preis auf Anfrage","Restelbergstrasse 28, 8044 Zürich, ZH","Preis auf Anfrage","«Schöner Wohnen am Züriberg - Mietzinse siehe Beilage»","2,5 Zimmer, Preis auf AnfrageRestelbergstrasse 28, 8044 Zürich, ZH«Schöner Wohnen am Züriberg - Mietzinse siehe Beilage»Möchten Sie temporär oder auch etwas länger in einem von 14 traumhaft schönen Appartements wohnen, welche bis ins letzte Detail raffiniert und gepflegt ausgestattet und eingerichtet wurden. Dabei steht Ihnen eine ganze Auswahl von «Typen» zur Verfügung, welche bestimmt Ihren individuellen Geschmack treffen werden. Neben liebevoll gestalteten Unikaten kommen Sie in den Genuss der ruhigen und beschaulichen Lage am Züriberg. Eine perfekte OEV-Anbindung rundet dieses großartige Angebot ab.Gerne bedienen wir Sie vorab mit der umfassenden Vermietungs"
"1703955467-279","https://www.immoscout24.ch/de/wohnung/mieten/kanton-zuerich?pn=31","4,5 Zimmer, 120 m², CHF 4265.—","Seefeldstrasse 253, 8008 Zürich, ZH","CHF 4265.—","«Grosszügige 4.5-Zimmer-Wohnung im Seefeld»","4,5 Zimmer, 120 m², CHF 4265.—Seefeldstrasse 253, 8008 Zürich, ZH«Grosszügige 4.5-Zimmer-Wohnung im Seefeld»LageZürich ist eine Stadt, die sicher jedem etwas zu bieten hat, sei es wegen der einmaligen Lage am Zürichsee, dem Alpenpanorama oder den verschiedenen Naherholungsgebieten. Nicht zu vergessen ist auch die vielfältige Palette an Einkaufsmöglichkeiten, diversen Sport-/Freizeitaktivitäten sowie die bunte Palette an den verschiedensten kulturellen Angeboten.Im Seefeld, wo sich Ihr neues Zuhause befindet, sind Sie umgeben von Park- und Quai-Anlagen, dem Chinagarten und vielem mehr. Die beiden Seebäder Tiefenbrunnen und Utoquai, der Botanische GartAnbieter kontaktierenKontaktieren"
"1703955467-280","https://www.immoscout24.ch/de/wohnung/mieten/kanton-zuerich?pn=31","2,5 Zimmer, 73 m², CHF 3730.—","Seefeldstrasse 102, 8008 Zürich, ZH","CHF 3730.—","«Stilvolles Wohnen im Trendquartier Seefeld»","2,5 Zimmer, 73 m², CHF 3730.—Seefeldstrasse 102, 8008 Zürich, ZH«Stilvolles Wohnen im Trendquartier Seefeld»Willkommen im ONE O TWO! Sie wollten schon immer den faszinierenden Charme des Zürcher Seefeld hautnah erleben? Dann treffen Sie mit einer Wohnung an dieser Toplage die richtige Entscheidung. Aktuell wird die Liegenschaft umfassend saniert. Per 01.07.2024 stehen 27 Mietwohnungen in den Grössen 1.5-Zimmer, 2.5-Zimmer, 5.5-Zimmer und 6.5-Zimmer zur Verfügung.Die Mieter dürfen sich auf folgende Annehmlichkeiten freuen:Klimaschonende, CO2-neutrale Heizung und Kühlung (Freecooling) mit Zürcher SeewasserRepräsentativer EingangKellerabteil mit Steckdo"
"1703955467-281","https://www.immoscout24.ch/de/wohnung/mieten/kanton-zuerich?pn=31","5,5 Zimmer, 134 m², CHF 5750.—","Volkmarstrasse 4, 8006 Zürich, ZH","CHF 5750.—","«Einzigartige Wohnung mit Garten an zentraler Lage im Kreis 6»","5,5 Zimmer, 134 m², CHF 5750.—Volkmarstrasse 4, 8006 Zürich, ZH«Einzigartige Wohnung mit Garten an zentraler Lage im Kreis 6»Die Wohnung kann mit der 3D-Besichtigung virtuell besichtigt werden: http://soraperra.ch/files/vr/Virtueller-Rundgang-Volkmarstr4-8006/vr.htmlWir vermieten per 01.11.2023 oder nach Vereinbarung eine sehr schöne, helle 5.5-Zimmerwohnung an einmaliger Lage im Kreis 6.  Im Herzen des Quartiers Unterstrass wurde um die Jahrhundertwende dieses herrschaftliche Wohnhaus erbaut. Im 2007 wurde das im Inventar für Denkmalpflege aufgenommene Gebäude aufwendig und mit viel Liebe zum Detail nachhaltig saniert.  Die bis in die Abendstunden besonnte Wohnung iAnbieter kontaktierenKontaktieren"
"1703955467-282","https://www.immoscout24.ch/de/wohnung/mieten/kanton-zuerich?pn=31","2,5 Zimmer, 46 m², CHF 1880.—","Riedthofstrasse 71, 8105 Regensdorf, ZH","CHF 1880.—","«Erstvermietung nach Totalsanierung!»","2,5 Zimmer, 46 m², CHF 1880.—Riedthofstrasse 71, 8105 Regensdorf, ZH«Erstvermietung nach Totalsanierung!»Wir vermieten im Block Riedthofstrasse 71, 8105 Regensdorf, totalsanierte Wohnungen in verschiedenen Grössen und Layouts.Die Wohnungen verfügen über:-Modernen und zeitlosen Innenausbau-Neue Küchen mit Schrankplatz und Glaskeramik-Neuwertige Laminatbodenbeläge-Helle Zimmer-Geräumige Balkone-Badezimmer auf neusten Stand-Möglichkeit auch für Dachwohnungen mit abgeschrägten Wänden-Schulen, öffentlicher Verkehr und Einkaufsmöglichkeiten in kurzer Gehdistanz erreichbar-Parkplätze und Garagenplätze zur Vermietung freiVerpassen Sie diese Chance nicht u"
"1703955467-283","https://www.immoscout24.ch/de/wohnung/mieten/kanton-zuerich?pn=31","4,5 Zimmer, 94 m², CHF 2072.—","Heusserstrasse 3, 8634 Hombrechtikon, ZH","CHF 2072.—","«Schöne Siedlung mit gepflegtem Garten»","4,5 Zimmer, 94 m², CHF 2072.—Heusserstrasse 3, 8634 Hombrechtikon, ZH«Schöne Siedlung mit gepflegtem Garten»Per sofort oder nach Vereinbarung vermieten wir diese attraktive und frisch sanierte 4.5-Zimmerwohnungen in einer gepflegten Siedlung mit grünem Umschwung. Die Überbauung ist durch eine Quartierstrasse erschlossen und somit sehr ruhig gelegen. Das Wohnobjekt überzeugt mit den folgenden Annehmlichkeiten;- grosses Wohnzimmer mit Parkettboden- vier abschliessbare Schlafzimmer mit Parkettboden- halboffene Küche mit Plattenboden und Fensterfront- mit Granitabdeckung- mit Glaskeramikherd - mit Geschirrspüler- Korridor mit Wandschrank- modernes Bad/WCVirtuelle TourAnbieter kontaktierenKontaktieren"
"1703955467-284","https://www.immoscout24.ch/de/wohnung/mieten/kanton-zuerich?pn=31","4,5 Zimmer, 102 m², CHF 2400.—","Bodenacherstrasse 18, 8121 Benglen, ZH","CHF 2400.—","«Platz für die ganze Familie»","4,5 Zimmer, 102 m², CHF 2400.—Bodenacherstrasse 18, 8121 Benglen, ZH«Platz für die ganze Familie»Per sofort nach Vereinbarung vermieten wir diese moderne 4.5-Zimmerwohnung in Benglen.Die Wohnung bietet Ihnen folgende Annehmlichkeiten:- Wohn- und Schlafzimmer mit Parkettboden - Küche und Nasszelle mit pflegeleichtem, dunklem Plattenboden- Offene Küche mit Glaskeramikherd, Geschirrspüler, Backofen und viel Stauraum für Ihre Küchenutensilien- Badezimmer mit WC, Lavabo mit integrierter Kommode, Spiegelschrank,Badewanne und Tageslicht- Separates WC mit Lavabo, Spiegelschrank und Dusche- Korridor mit praktischen Einbauschränken- Balkon für gemütAnbieter kontaktierenKontaktieren"
"1703955467-285","https://www.immoscout24.ch/de/wohnung/mieten/kanton-zuerich?pn=31","2,5 Zimmer, 54 m², CHF 1800.—","Bungert 6, 8909 Zwillikon, ZH","CHF 1800.—","«Moderne 2.5-Zimmerwohnung»","2,5 Zimmer, 54 m², CHF 1800.—Bungert 6, 8909 Zwillikon, ZH«Moderne 2.5-Zimmerwohnung»"
"1703955467-286","https://www.immoscout24.ch/de/wohnung/mieten/kanton-zuerich?pn=31","3,5 Zimmer, 78 m², CHF 1530.—","Hauptstrasse 68, 8246 Langwiesen, ZH","CHF 1530.—","«Wiedervermietung nach Teilrenovationen»","3,5 Zimmer, 78 m², CHF 1530.—Hauptstrasse 68, 8246 Langwiesen, ZH«Wiedervermietung nach Teilrenovationen»Anfangs November werden die beiden Teppichböden durch Parkettböden ersetzt. In der ganzen Wohnung werden sämtliche Wände und Decken frisch gestrichen. Ebenso wird das ganze Holzwerk (Türen, Zargen, Decken, Fenstersimse etc.) weiss gestrichen. Der sonnige Balkon mit wundervoller Weitsicht wird Sie begeistern. Die Bilder zeigen teilweise eine Vergleichswohnung.Die Highlights im Überblick:- Helle Küche mit Fenster- Badezimmer mit Badewanne- Waschmaschine im Badezimmer- Entrée mit grossem Essbereich- Helles Wohnzimmer mit Parkettboden- Grosser sonnAnbieter kontaktierenKontaktieren"
"1703955467-287","https://www.immoscout24.ch/de/wohnung/mieten/kanton-zuerich?pn=31","3,5 Zimmer, 140 m², CHF 5400.—","Rebwiesstr. 60, 8702 Zollikon, ZH","CHF 5400.—","«Befristet bis zum 31.03.2025 - Moderne Wohnung als Zwischennutzung»","3,5 Zimmer, 140 m², CHF 5400.—Rebwiesstr. 60, 8702 Zollikon, ZH«Befristet bis zum 31.03.2025 - Moderne Wohnung als Zwischennutzung»Sie sind sich Wohnen auf hohem Standard gewohnt? Dann haben wir genau das Richtige für Sie! Die moderne Liegenschaft verfügt über einen hochwertigen Ausbaustandard und besticht besonders durch folgende Merkmale:Parkettboden in ganzer WohnungModerne Küche mit Steamer (V-Zug Geräte)Bad/WC Dusche/WCEigener Waschturm (V-Zug Geräte) in der WohnungGrosser sonniger Balkon Öffentliche Verkehrsmittel (Forchbahn) in wenigen Gehminuten  erreichbarInternationale Schule in der Näheeigenes KellerabteilGerne können Sie sich betreffend einem BesichtigungstermiAnbieter kontaktierenKontaktieren"
"1703955467-288","https://www.immoscout24.ch/de/wohnung/mieten/kanton-zuerich?pn=31","1,5 Zimmer, 28 m², CHF 2660.—","Martastrasse 121, 8003 Zürich, ZH","CHF 2660.—","«Schöne Wiedikon 1.5 Zim.+W/T, +Lag, 1 Min. zum Markt, über Blueground»","1,5 Zimmer, 28 m², CHF 2660.—Martastrasse 121, 8003 Zürich, ZH«Schöne Wiedikon 1.5 Zim.+W/T, +Lag, 1 Min. zum Markt, über Blueground»"
"1703955470-289","https://www.immoscout24.ch/de/wohnung/mieten/kanton-zuerich?pn=30","3,5 Zimmer, 74 m², CHF 2354.—","Albisstrasse 51, 8134 Adliswil, ZH","CHF 2354.—","«Erstbezug nach Totalsanierung - 3.5-Zimmerwohnung mit Blick ins Grüne»","3,5 Zimmer, 74 m², CHF 2354.—Albisstrasse 51, 8134 Adliswil, ZH«Erstbezug nach Totalsanierung - 3.5-Zimmerwohnung mit Blick ins Grüne»Ihre Wohlfühloase liegt uns am Herzen! Per 1. Januar 2024 vermieten wir eine totalsanierte 3.5-Zimmerwohnungen mit Blick ins Grüne. Die Wohnung verfügt über die folgenden Besonderheiten: - Graue Küche mit heller Abdeckung inkl. Geschirrspüler- Heller Eichenparkett- Badezimmer mit grauen Natursteinplatten- Glasfaseranschluss- geräumige Zimmer- Balkon mit Sicht ins Grüne- Bodenheizung in allen Räumen Aussenparkplätze können für monatlich CHF 60.00 dazu gemietet werden. Bitte beachten Sie, dass es bei den Bildern um Referenzbilder handelt. Mit ein"
"1703955470-290","https://www.immoscout24.ch/de/wohnung/mieten/kanton-zuerich?pn=30","4,5 Zimmer, 174 m², CHF 7260.—","8053 Zürich, ZH","CHF 7260.—","«MODERN, LUXURIÖS MIT ÜBERDACHTER TERRASSE»","4,5 Zimmer, 174 m², CHF 7260.—8053 Zürich, ZH«MODERN, LUXURIÖS MIT ÜBERDACHTER TERRASSE»Willkommen im Paradies der Wohnlichkeit! Diese atemberaubende 4,5-Zimmer-Wohnung in Zürich ist ein Traum für Familien und Geniesser. Mit 174 m² purem Wohnkomfort bietet sie ein Hauptschlafzimmer samt eigenem Bad, ein einladendes Gästezimmer und ein vielseitiges Büro oder zusätzliches Schlafzimmer mit eigenem Bad. Das geräumige Wohnzimmer, die Hightech-Küche und das Gästebad bieten Raum zum Entfalten. Die 83 m² grosse Terrasse mit überdachtem Aussenbereich und weitläufiger Wiese verbinden Innen- und Aussenbereich. Ein Einstellplatz für Ihr Auto,Anbieter kontaktierenKontaktieren"
"1703955470-291","https://www.immoscout24.ch/de/wohnung/mieten/kanton-zuerich?pn=30","4,5 Zimmer, 120 m², CHF 3480.—","8907 Wettswil, ZH","CHF 3480.—","«WOHNEN ""ALL INKLUSIVE"" MIT NIEDRIGEM STEUERFUSS»","4,5 Zimmer, 120 m², CHF 3480.—8907 Wettswil, ZH«WOHNEN ""ALL INKLUSIVE"" MIT NIEDRIGEM STEUERFUSS»In Wettswil wartet dieser Wohntraum in idyllischer Umgebung auf Sie. Das Wohnzimmer und das Schlafzimmer mit Blick ins Grüne laden zum Entspannen und Verweilen ein. Die Wohnung ist komplett möbliert und mit allem Notwendigen inklusive Kaffeemaschine ausgestattet. Die Wohnung hat einen genialen Grundriss und bietet sehr viel Raum zum Leben. Die offene Küche hat viel Stauraum und Zugang zum Gartensitzplatz. Das Wohnzimmer mit Balkonzugang bietet viel Platz zum Entspannen. Im grossen Schlafzimmer finden Sie eine Garderobe und ein neuwertiges DoppeAnbieter kontaktierenKontaktieren"
"1703955470-292","https://www.immoscout24.ch/de/wohnung/mieten/kanton-zuerich?pn=30","3,5 Zimmer, 130 m², CHF 2720.—","8173 Neerach, ZH","CHF 2720.—","«GROSSZÜGIG MIT IDYLLISCHEM CHEMINÉE»","3,5 Zimmer, 130 m², CHF 2720.—8173 Neerach, ZH«GROSSZÜGIG MIT IDYLLISCHEM CHEMINÉE»Dieses charmante Dachgeschoss in Neerach bietet eine traumhafte Aussicht und eine Wohnfläche von 130 m². Die Wohnung besticht durch ihre beiden grosszügigen überdachten Balkone, einen idyllischen Schwedenofen sowie einen echten Holzboden. Die einzigartige Balkendecke verleiht dem Raum einen besonderen Charme. Die direkte ÖV-Anbindung und die vielfältige Garagen-Auswahl machen das Wohnen hier besonders komfortabel. Ein privater Estrich mit grossem Stauraum sowie ein persönlicher Waschturm perfektionieren das Wohnen.Dieses BETTERHOMES-Angebot zeiAnbieter kontaktierenKontaktieren"
"1703955470-293","https://www.immoscout24.ch/de/wohnung/mieten/kanton-zuerich?pn=30","3,5 Zimmer, CHF 3350.—","Rütistrasse 30, 8032 Zürich, ZH","CHF 3350.—","«Grosszügige 3.5 Zimmer-Wohnung mit schöner Aussicht»","3,5 Zimmer, CHF 3350.—Rütistrasse 30, 8032 Zürich, ZH«Grosszügige 3.5 Zimmer-Wohnung mit schöner Aussicht»In einem ruhigem aber zentralen Wohnquartier vermieten wir nach Vereinbarung diese schöne 3.5-Zimmerwohnung im 2. OG mit Balkon.Das Mietobjekt ist wie folgt ausgestattet:- Wohn-/Schlafräume verfügen über Parkettboden- Nasszellen und Küche mit Platten - Korridor mit Einbauschränken und Klinkerboden- 2 Nasszellen: 1 Badezimmer und 1 separates WC- sonniger Balkon mit WeitsichtDie Liegenschaft befindet sich im Quartier Hottingen. Innert wenigen Gehminuten erreicht man die Bushaltestellen ""Klosbach"" (Triemli/Tiefenbrunnen). Ebenfalls der Römerhof so"
"1703955470-294","https://www.immoscout24.ch/de/wohnung/mieten/kanton-zuerich?pn=30","3,5 Zimmer, CHF 2000.—","Zürichstrasse 57a, 8413 Neftenbach, ZH","CHF 2000.—","«Heimelige Dachgeschosswohnung in Neftenbach»","3,5 Zimmer, CHF 2000.—Zürichstrasse 57a, 8413 Neftenbach, ZH«Heimelige Dachgeschosswohnung in Neftenbach» Die Liegenschaft ist sehr familienfreundlich gelegen. Einkaufsmöglichkeiten und öffentliche Verkehrsmittel erreichen sie in wenigen Minuten.Die schöne Dachwohnung (ohne Balkon) mit offener Küche und grosszügigem Essbereich bietet viel Stauraum und Charme. Das Badezimmer verfügt über eine Dusche, Badewanne, WC und Lavabo. Das helle und heimelige Wohnzimmer lädt zum Verweilen ein. Die 3.5 Zimmer-Wohnung verfügt über eine Waschmaschine sowie einen eigenen Tumbler.Zur Wohnung gehört ein Kellerabteil im UG. Für die Velos steht ein separater Velorau"
"1703955470-295","https://www.immoscout24.ch/de/wohnung/mieten/kanton-zuerich?pn=30","2,5 Zimmer, 60 m², CHF 3710.—","Kalkbreitestrasse 41, 8003 Zürich, ZH","CHF 3710.—","«Spacious modern furnished 1-bedroom apartment with balcony and weekly cleaning service for rent»","2,5 Zimmer, 60 m², CHF 3710.—Kalkbreitestrasse 41, 8003 Zürich, ZH«Spacious modern furnished 1-bedroom apartment with balcony and weekly cleaning service for rent»We rent a modern, bright and tastefully furnished 1-bedroom apartment with a large balcony to the inner curt yard in the popular district 3 in Zürich in Zürich-Wiedikon.Included in the rent is the weekly cleaning service with change of bed linen and towels from the bathroom, a wireless high-speed internet, a public laundry with washing machine and dryer and a gym.The separate kitchen is fully equipped with dishwasher, oven, microwave, coffee machine, toaster, water cooker and all you need in the kitchen.On demand we rent parking place in the co"
"1703955470-296","https://www.immoscout24.ch/de/wohnung/mieten/kanton-zuerich?pn=30","2,5 Zimmer, 55 m², CHF 3710.—","Wuhrstrasse 30, 8003 Zürich, ZH","CHF 3710.—","«Tastefully furnished 1-bedroom apartment with balcony ans weekly cleaning service for rent»","2,5 Zimmer, 55 m², CHF 3710.—Wuhrstrasse 30, 8003 Zürich, ZH«Tastefully furnished 1-bedroom apartment with balcony ans weekly cleaning service for rent»We rent a modern and tastefully furnished 1-bedroom apartment with balcony or with garden seat and with weekly cleaning service in the popular district 3 in Zürich-Wiedikon.The property is located in a quiet and green side street, close from several restaurants, coffees, shops, bars and public transportations. The train station Wiedikon is in 5 minutes walking distance.The flat features a fully equipped and spacious open kitchen, with dishwasher, oven, microwave, Nespresso coffee machine and all you need in the kitchen.The elegant bathroom is w"
"1703955470-297","https://www.immoscout24.ch/de/wohnung/mieten/kanton-zuerich?pn=30","2,5 Zimmer, 71 m², CHF 4055.—","Rotachstrasse 17, 8003 Zürich, ZH","CHF 4055.—","«Modern furnished 1-bedroom apartment with garden seat for rent»","2,5 Zimmer, 71 m², CHF 4055.—Rotachstrasse 17, 8003 Zürich, ZH«Modern furnished 1-bedroom apartment with garden seat for rent»The property is located in the popular district 3 in Zürich-Wiedikon in a quiet side street close from the shopping area, restaurants, bars and public transportations.The spacious 1-bedroom flat with garden seat is modern furnished with a fully equipped open kitchen with cooker, oven, microwave, refrigerator, dishwasher, coffee maker, toaster, kettle, dishes, and everything else you need in the kitchen. The bedroom has a large 1.80 bed which is equipped with bed linen. As well there is a spacious wardrobe in the bedroom. The bathroom is equippe"
"1703955470-298","https://www.immoscout24.ch/de/wohnung/mieten/kanton-zuerich?pn=30","3,5 Zimmer, 79 m², CHF 4080.—","Gertrudstrasse 22, 8003 Zürich, ZH","CHF 4080.—","«Modern furnished 2-bedroom apartment with balcony and weekly cleaning service for rent»","3,5 Zimmer, 79 m², CHF 4080.—Gertrudstrasse 22, 8003 Zürich, ZH«Modern furnished 2-bedroom apartment with balcony and weekly cleaning service for rent»We rent a tastefully and modern furnished 2-bedroom apartment with balcony and weekly cleaning service in the popular district 3 in Zürich - Wiedikon.The open kitchen is fully equipped with dishwasher, oven, microwave, Nespresso machine and everything you need in the kitchen.The living room provides a sofa bed and a big flatscreen TV with international channels.Included in the service is the wireless high-speed internet, the weekly cleaning service with change of bed linen and towels from the bathroom as well a public laundry with washing machi"
"1703955470-299","https://www.immoscout24.ch/de/wohnung/mieten/kanton-zuerich?pn=30","2,5 Zimmer, 55 m², CHF 3610.—","Aemtlerstrasse 86, 8003 Zürich, ZH","CHF 3610.—","«Spacious 1-bedroom apartment with balcony and weekly cleaning service for rent»","2,5 Zimmer, 55 m², CHF 3610.—Aemtlerstrasse 86, 8003 Zürich, ZH«Spacious 1-bedroom apartment with balcony and weekly cleaning service for rent»We rent a spacious and tastefully furnished 1-bedroom apartment with balcony and weekly cleaning service in the popular district 3 in Zürich - Wiedikon.The flat has a fully equipped kitchen with dishwasher, oven, microwave, coffee machine, toaster, water boiler and all you need in the kitchen.The living room provides a sofa bed, a dining table and a big flatscreen TV with international channels.Included in service is the weekly cleaning with change of bed linen and towels from the bathroom, a high-speed wireless internet, a laundry room with wa"
"1703955470-300","https://www.immoscout24.ch/de/wohnung/mieten/kanton-zuerich?pn=30","2,5 Zimmer, 55 m², CHF 2350.—","Eichliackerstrasse 8, 8406 Winterthur, ZH","CHF 2350.—","«Business- Appartement möbliert zu vermieten»","2,5 Zimmer, 55 m², CHF 2350.—Eichliackerstrasse 8, 8406 Winterthur, ZH«Business- Appartement möbliert zu vermieten»Wir vermieten eine modern möblierte 2.5 Zimmer Wohnung in Winterthur.Das 2.5 Zimmer Apartment liegt an zentraler und ruhiger Lage, in der Nähe des Hauptbahnhofes und Autobahnanschluss Winterthur-Töss.Zürich erreicht man mit dem Zug in weniger als 15 Minuten.Die Wohnung liegt Nahe des Naherholungsgebietes Töss. Das Apartment ist ausgestattet mit Internetanschluss, Internettelefon, Digital-TV, Radio-CD-Player, DVD, moderner Küche mit Granitabdeckung, GK, GS, Nespresso-Kaffeemaschine.Besichtigungen finden nach Vereinbarung statt."
"1703955470-301","https://www.immoscout24.ch/de/wohnung/mieten/kanton-zuerich?pn=30","2,5 Zimmer, 50 m², CHF 3710.—","Rotachstrasse 20, 8003 Zürich, ZH","CHF 3710.—","«Modern furnished 1-bedroom attic apartment with weekly cleaning service for rent»","2,5 Zimmer, 50 m², CHF 3710.—Rotachstrasse 20, 8003 Zürich, ZH«Modern furnished 1-bedroom attic apartment with weekly cleaning service for rent»We rent a spacious, bright and tastefully furnished 1-bedroom apartment with terrace and weekly cleaning service in the popular district 3 in Zürich-Wiedikon.The open kitchen is fully equipped with dishwasher, oven, microwave, Nespresso machine, toaster and all you need in the kitchen.The living room provides a confortable couch, a dining table and a flatscreen TV with international channels.Included in the service is a wireless high-speed internet, the weekly cleaning service with change of bed linen and towels of the bathroom, a public laundr"
"1703955470-302","https://www.immoscout24.ch/de/wohnung/mieten/kanton-zuerich?pn=30","1,5 Zimmer, 36 m², CHF 2990.—","Gertrudstrasse 22, 8003 Zürich, ZH","CHF 2990.—","«Furnished and spacious 1.5-bedroom apartment with weekly cleaning service for rent»","1,5 Zimmer, 36 m², CHF 2990.—Gertrudstrasse 22, 8003 Zürich, ZH«Furnished and spacious 1.5-bedroom apartment with weekly cleaning service for rent»We rent a bright and modern furnished and spacious 1.5-room apartment with balcony in the popular district 3 in Zürich-Wiedikon.The property is centrally located in a side street close from Idaplatz und Brupacherplatz.Included in the service is the weekly cleaning with change of bed linen & towels from the bathroom, a high-speed wireless internet and a public laundry with washer and dryer.The spacious kitchen is equipped with a dining table, a dishwasher, oven, microwave, Nespresso machine, toaster and everything you need in the kitchen.The liv"
